{
  "author": null,
  "build_epoch": 1790640000,
  "date": "2026-09-30",
  "document_base_commit": "0cfc197836a320709ba0fa8931018728020320b0",
  "editorial_state": "DRAFT",
  "evidence_snapshot_commits": [
    "7a7d3dcbd1ff8e594ac57459c3db06306083c3ca"
  ],
  "experimental_reproduction": "NOT_RUN",
  "id": "R01-prior-art",
  "included_reports": [],
  "kind": "foundation",
  "language": "pt",
  "raw_data_availability": "NOT_ACCESSED",
  "schema_version": "tesy-campaign-v1",
  "scientific_state": "BROAD_NOVELTY_NO_GO / ENGINEERING_AND_MEASUREMENT_GO",
  "scope_note": "Revisão bibliográfica orientada ao problema, com corte em 30 setembro 2026; não é systematic review nem busca de patentes.",
  "state_evidence": {
    "quote": "| N0 prior-art screen | IMPLEMENTED | second pass records `BROAD_NOVELTY_NO_GO / ENGINEERING_AND_MEASUREMENT_GO`; not a patent/legal opinion |",
    "source": "E-R00-STATUS",
    "type": "text"
  },
  "subtitle": "Sparse MoE, multi-tier offload, cache/prefetch, CPU/GPU, exactness e speculation",
  "title": "R01: prior art e fronteira científica do Tesy",
  "version": "1.0.1"
}
